{
  "format": 1,
  "package": {
    "composer": "storyfeed/storyfeed"
  },
  "facts": [
    {
      "id": "has-feeds",
      "description": "An app-owned page renders an activity, history or audit timeline.",
      "computed": {
        "signals": [
          {
            "kind": "import",
            "specifiers": [
              "@/components/Kit#ActivityStream"
            ]
          },
          {
            "kind": "file-name",
            "globs": [
              "resources/js/**/*Timeline*.vue",
              "resources/js/**/*Activity*.vue",
              "resources/js/**/*AuditLog*.vue"
            ]
          },
          {
            "kind": "php-class",
            "extends": [
              "Storyfeed\\Stories\\Story",
              "Storyfeed\\Feed"
            ]
          },
          {
            "kind": "php-class",
            "implements": [
              "Storyfeed\\Contracts\\Feedable",
              "Storyfeed\\Contracts\\PublishesToFeed"
            ]
          }
        ]
      }
    },
    {
      "id": "has-activity-log",
      "description": "An app records an activity log or audit history, with or without a feed page.",
      "computed": {
        "signals": [
          {
            "kind": "composer",
            "packages": [
              "spatie/laravel-activitylog",
              "owen-it/laravel-auditing"
            ]
          },
          {
            "kind": "php-class",
            "names": [
              "*ActivityLog*",
              "*AuditLog*",
              "*ActivityFeed*",
              "*Timeline*"
            ]
          },
          {
            "kind": "php-class",
            "extends": [
              "Spatie\\Activitylog\\Models\\Activity",
              "OwenIt\\Auditing\\Models\\Audit"
            ]
          },
          {
            "kind": "migration",
            "tables": [
              "activity_log",
              "activities",
              "events"
            ]
          },
          {
            "kind": "import",
            "specifiers": [
              "@/components/Kit#ActivityStream"
            ]
          },
          {
            "kind": "file-name",
            "globs": [
              "resources/js/**/*Timeline*.vue",
              "resources/js/**/*Activity*.vue",
              "resources/js/**/*AuditLog*.vue"
            ]
          },
          {
            "kind": "php-class",
            "extends": [
              "Storyfeed\\Stories\\Story",
              "Storyfeed\\Feed"
            ]
          },
          {
            "kind": "php-class",
            "implements": [
              "Storyfeed\\Contracts\\Feedable",
              "Storyfeed\\Contracts\\PublishesToFeed"
            ]
          }
        ]
      }
    }
  ],
  "surfaces": [
    {
      "id": "activity.recording",
      "layer": "backend",
      "group": "activity",
      "label": "Record events through PublishesToFeed, Story classes and the recording API",
      "feature": "core",
      "applies": {
        "any": [
          "has-feeds",
          "has-activity-log"
        ]
      },
      "uses": {
        "classes": [
          "Storyfeed\\Contracts\\PublishesToFeed",
          "Storyfeed\\Stories\\Story",
          "Storyfeed\\Stories\\Verb",
          "Storyfeed\\Facades\\Story",
          "Storyfeed\\Facades\\Storyfeed",
          "Storyfeed\\PendingActivity",
          "Storyfeed\\Act"
        ]
      },
      "handRolled": [
        {
          "kind": "composer",
          "packages": [
            "spatie/laravel-activitylog"
          ]
        },
        {
          "kind": "migration",
          "tables": [
            "activity_log",
            "activities",
            "events"
          ]
        }
      ],
      "docs": "https://docs.storyfeed.dev/basics/recording-activities",
      "status": "stable",
      "replaces": {
        "composer": [
          "spatie/laravel-activitylog"
        ]
      }
    },
    {
      "id": "activity.query",
      "layer": "backend",
      "group": "activity",
      "label": "Retrieve a feed through FeedBuilder in Log or Live mode",
      "feature": "core",
      "applies": {
        "any": [
          "has-feeds",
          "has-activity-log"
        ]
      },
      "uses": {
        "classes": [
          "Storyfeed\\FeedBuilder",
          "Storyfeed\\Feed",
          "Storyfeed\\ComposedFeed",
          "Storyfeed\\FeedPaginator",
          "Storyfeed\\FeedSimplePaginator"
        ]
      },
      "handRolled": [
        {
          "kind": "php-class",
          "names": [
            "*ActivityFeed*",
            "*Timeline*"
          ]
        },
        {
          "kind": "file-name",
          "globs": [
            "resources/js/**/*Timeline*.vue",
            "resources/js/**/*Activity*.vue",
            "resources/js/**/*History*.vue"
          ]
        }
      ],
      "docs": "https://docs.storyfeed.dev/retrieving/retrieving-feeds",
      "status": "stable",
      "replaces": {
        "components": [
          "*Timeline*",
          "*ActivityLog*",
          "*AuditLog*"
        ]
      }
    },
    {
      "id": "activity.snapshots",
      "layer": "backend",
      "group": "activity",
      "label": "Describe participant snapshots through Feedable and FeedEntity",
      "feature": "core",
      "applies": {
        "any": [
          "has-feeds",
          "has-activity-log"
        ]
      },
      "uses": {
        "classes": [
          "Storyfeed\\Contracts\\Feedable",
          "Storyfeed\\Concerns\\InteractsWithFeed",
          "Storyfeed\\FeedEntity",
          "Storyfeed\\FeedableRegistration"
        ]
      },
      "handRolled": [
        {
          "kind": "composer",
          "packages": [
            "spatie/laravel-activitylog"
          ]
        },
        {
          "kind": "migration",
          "tables": [
            "activity_log",
            "activities",
            "events"
          ]
        }
      ],
      "docs": "https://docs.storyfeed.dev/basics/feedable-models",
      "status": "stable"
    },
    {
      "id": "activity.context",
      "layer": "backend",
      "group": "activity",
      "label": "Partition feed activities with explicit context and scoped Feed definitions",
      "feature": "core",
      "applies": {
        "any": [
          "has-feeds",
          "has-activity-log"
        ]
      },
      "uses": {
        "classes": [
          "Storyfeed\\Http\\Middleware\\UseContext",
          "Storyfeed\\Feed"
        ]
      },
      "handRolled": [
        {
          "kind": "php-class",
          "names": [
            "*ActivityFeed*",
            "*Timeline*"
          ]
        }
      ],
      "docs": "https://docs.storyfeed.dev/recording/containers-and-context",
      "status": "stable"
    },
    {
      "id": "activity.config",
      "layer": "backend",
      "group": "activity",
      "label": "Configure Storyfeed storage tables and the participant morph alias",
      "feature": "core",
      "applies": {
        "any": [
          "has-feeds",
          "has-activity-log"
        ]
      },
      "uses": {
        "config": [
          "storyfeed.morph_alias",
          "storyfeed.tables"
        ]
      },
      "handRolled": [
        {
          "kind": "migration",
          "tables": [
            "activity_log",
            "activities",
            "events"
          ]
        }
      ],
      "docs": "https://docs.storyfeed.dev/reference/configuration",
      "status": "stable"
    }
  ],
  "nonSurfaces": [
    {
      "ref": "Storyfeed\\Actions\\AssignGroupingBursts",
      "reason": "Maintenance and write-path implementation behind the recording and snapshot APIs."
    },
    {
      "ref": "Storyfeed\\Actions\\AssignToBatch",
      "reason": "Maintenance and write-path implementation behind the recording and snapshot APIs."
    },
    {
      "ref": "Storyfeed\\Actions\\BackfillAncestors",
      "reason": "Maintenance and write-path implementation behind the recording and snapshot APIs."
    },
    {
      "ref": "Storyfeed\\Actions\\BundleComposites",
      "reason": "Maintenance and write-path implementation behind the recording and snapshot APIs."
    },
    {
      "ref": "Storyfeed\\Actions\\CloseBatch",
      "reason": "Maintenance and write-path implementation behind the recording and snapshot APIs."
    },
    {
      "ref": "Storyfeed\\Actions\\CloseBatches",
      "reason": "Maintenance and write-path implementation behind the recording and snapshot APIs."
    },
    {
      "ref": "Storyfeed\\Actions\\CurateCluster",
      "reason": "Maintenance and write-path implementation behind the recording and snapshot APIs."
    },
    {
      "ref": "Storyfeed\\Actions\\DeleteFromFeed",
      "reason": "Maintenance and write-path implementation behind the recording and snapshot APIs."
    },
    {
      "ref": "Storyfeed\\Actions\\ForceDeleteFromFeed",
      "reason": "Maintenance and write-path implementation behind the recording and snapshot APIs."
    },
    {
      "ref": "Storyfeed\\Actions\\ForgetActivities",
      "reason": "Maintenance and write-path implementation behind the recording and snapshot APIs."
    },
    {
      "ref": "Storyfeed\\Actions\\PruneActivities",
      "reason": "Maintenance and write-path implementation behind the recording and snapshot APIs."
    },
    {
      "ref": "Storyfeed\\Actions\\PurgeActivities",
      "reason": "Maintenance and write-path implementation behind the recording and snapshot APIs."
    },
    {
      "ref": "Storyfeed\\Actions\\RebuildAncestors",
      "reason": "Maintenance and write-path implementation behind the recording and snapshot APIs."
    },
    {
      "ref": "Storyfeed\\Actions\\RebuildGroupingBursts",
      "reason": "Maintenance and write-path implementation behind the recording and snapshot APIs."
    },
    {
      "ref": "Storyfeed\\Actions\\RebuildSnapshots",